name;calories;proteins;carbs;fat;calcium;iron;vitamin_c
Dessert (aliment moyen);255.0;4.39;32.9;11.3;67.6;1.3;2.42
Salade de museau de porc, avec sauce, préemballée;172.0;8.51;0.89;14.8;14.7;1.4;0.0
Salade de cervelas, avec sauce, préemballée;259.0;7.6;1.93;24.2;0.0;0.0;0.0
Salade de céleri rémoulade, préemballée;114.0;0.94;3.14;10.2;34.0;0.23;3.06
Salade de thon et légumes, appertisée;117.0;9.15;8.13;4.7;20.7;1.1;2.75
Salade composée avec viande ou poisson, appertisée;110.0;8.06;6.4;5.3;22.0;0.7;0.0
Champignons à la grecque, préemballés;76.3;2.07;3.53;5.47;19.5;1.06;6.67
Salade de pommes de terre, faite maison;127.0;2.68;9.9;8.2;19.0;0.65;10.0
Taboulé ou salade de semoule aux légumes, préemballé;179.0;4.88;23.7;6.7;24.0;0.88;6.27
Salade de pomme de terre à la piémontaise, préemballée;130.0;4.5;8.87;8.3;13.0;0.43;21.6
Salade de museau de boeuf, avec sauce, préemballée;118.0;11.7;0.8;7.6;0.0;0.0;0.0
Salade de riz, appertisée;127.0;5.13;16.1;4.35;23.3;0.43;4.48
Salade de pâtes au fromage et légumes, avec sauce;119.0;4.4;13.7;4.8;14.0;0.6;21.0
Salade de pâtes aux légumes et poisson ou viande, avec sauce, préemballée;160.0;6.24;14.2;8.24;24.0;0.95;12.3
Macédoine de légumes en salade, avec sauce, préemballée;129.0;2.5;3.47;10.7;44.0;0.72;5.93
Salade César au poulet (salade verte, fromage, croûtons, sauce), préemballée;151.0;8.13;4.88;10.0;100.0;0.5;1.11
Salade végétarienne à base de boulgour et/ou quinoa et légumes, préemballée;168.0;4.06;17.4;8.3;37.0;1.2;0.0
Salade de céleri et carotte rémoulade, préemballée;79.6;1.0;5.43;5.33;0.0;0.0;0.0
Salade de pomme de terre au thon, préemballée;124.0;5.57;8.13;7.7;0.0;0.0;0.0
Salade de pomme de terre à la saucisse, préemballée;156.0;3.08;8.75;11.6;0.0;0.0;0.0
Salade composée à base de crudités, charcuterie et fromage, avec sauce, préemballée;153.0;7.45;4.96;10.9;0.0;0.0;0.0
Salade composée à base de crudités et produits de la mer, avec sauce, préemballée;120.0;4.78;7.58;7.5;0.0;0.0;0.0
Salade composée à base de crudités, oeuf et produits de la mer, avec sauce, préemballée;108.0;4.76;3.77;7.57;0.0;0.0;0.0
Salade composée à base de crudités, poulet et fromage, avec sauce, préemballée;150.0;7.13;5.28;10.8;0.0;0.0;0.0
Salade composée à base de crudités et poulet, avec sauce, préemballée;88.0;4.13;4.28;5.35;0.0;0.0;0.0
Salade de carottes râpées, avec sauce, préemballée;74.2;0.84;5.67;4.77;31.0;0.0;0.0
Salade de betterave, avec sauce, préemballée;59.4;1.44;5.11;3.0;31.2;0.42;4.69
Salade de chou et carotte ou coleslaw, avec sauce, préemballée;105.0;0.94;5.78;8.1;39.0;1.3;21.6
Salade de concombre à la crème/fromage blanc, préemballée;77.9;1.06;0.58;7.5;25.2;0.0;5.77
Salade de lentilles et saucisse fumée, préemballée;177.0;7.0;8.9;11.8;0.0;0.0;0.0
Salade grecque, avec sauce, préemballée;81.5;2.0;1.4;7.1;0.0;0.0;0.0
Salade de riz au thon et légumes, avec sauce, préemballée;145.0;5.08;16.8;5.98;0.0;0.0;0.0
Taboulé ou salade de semoule au poulet, préemballé;176.0;5.9;20.1;7.45;18.0;0.8;0.0
Salade de pâtes au surimi, avec sauce, préemballée;208.0;4.19;14.1;14.5;22.7;0.48;4.69
Salade Alaska au surimi, ananas, carottes, avec sauce, préemballée;170.0;3.81;7.12;13.4;25.8;0.0;8.68
Salade de pâtes au poulet, fromage et crudités, avec sauce, préemballée;175.0;8.19;12.4;9.5;69.8;0.66;6.03
Salade de pâtes aux poulet, oeuf, fromage et crudités, avec sauce, préemballée;167.0;8.19;12.4;8.7;70.9;0.67;4.58
Salade de pâtes au jambon cru, fromage et crudités, avec sauce, préemballée;191.0;7.31;15.1;10.6;60.8;0.63;5.45
Salade de chou rouge, avec sauce, préemballée;103.0;1.23;4.73;8.25;0.0;0.0;0.0
Salade de pâtes au poulet et crudités, avec sauce, préemballée;131.0;5.91;13.5;5.52;0.0;0.0;0.0
Soupe aux lentilles, préemballée à réchauffer;63.3;3.19;7.64;1.87;25.0;1.07;1.7
Soupe à la volaille et aux légumes, préemballée à réchauffer;30.8;3.09;2.6;0.8;0.0;0.0;0.0
Soupe aux légumes variés, préemballée à réchauffer;36.8;0.84;4.5;1.45;14.0;0.14;5.75
Soupe de poissons et/ou crustacés, préemballée à réchauffer;50.0;4.11;2.71;2.35;130.0;0.61;0.0
Soupe aux légumes variés, déshydratée reconstituée;35.5;0.76;5.7;0.91;21.0;0.19;6.17
Soupe aux poireaux et pommes de terre, préemballée à réchauffer;37.1;0.91;5.12;1.25;16.0;0.17;7.95
Soupe à la volaille et aux vermicelles, préemballée à réchauffer;23.2;1.24;3.28;0.56;7.96;0.14;0.0
Bouillon de viande et légumes type pot-au-feu, prêt à consommer;5.76;0.53;0.24;0.3;1.0;0.1;0.0
Soupe à l'oignon, préemballée à réchauffer;60.8;1.64;4.26;3.83;12.0;0.27;0.5
Soupe aux champignons, préemballée à réchauffer;40.3;0.94;4.1;2.12;7.0;0.09;0.0
Soupe à la carotte, préemballée à réchauffer;35.8;0.68;4.03;1.61;15.0;0.3;11.0
Soupe à la tomate, préemballée à réchauffer;36.2;0.76;5.88;0.88;11.0;0.14;6.4
Soupe chorba frik, à base de viande et de frik;62.9;3.75;5.4;2.5;19.0;0.97;3.2
Soupe minestrone, préemballée à réchauffer;46.5;1.51;4.97;1.93;33.3;0.56;1.25
Soupe au pistou, déshydratée reconstituée;27.0;1.01;4.77;0.28;19.0;0.4;7.0
Soupe de poissons et/ou crustacés, déshydratée reconstituée;40.9;0.91;5.66;1.54;0.0;0.0;0.0
Soupe asiatique, avec pâtes, déshydratée reconstituée;38.4;1.12;5.69;1.14;0.0;0.0;0.0
Soupe marocaine, déshydratée reconstituée;39.9;2.07;6.43;0.46;0.0;0.0;0.0
Soupe aux poireaux et pommes de terre, déshydratée reconstituée;36.2;0.76;4.93;1.4;0.0;0.0;30.0
Soupe à la volaille et aux légumes, déshydratée reconstituée;27.3;0.99;4.58;0.44;0.0;0.0;3.0
Bouillon de boeuf, déshydraté reconstitué;6.14;0.85;0.36;0.15;5.5;0.17;0.0
Soupe aux asperges, déshydratée reconstituée;37.4;0.79;5.38;1.34;0.0;0.0;0.0
Soupe à la tomate et aux vermicelles, préemballée à réchauffer;38.0;1.2;6.09;0.77;0.0;0.0;20.0
Soupe aux céréales et aux légumes, déshydratée reconstituée;47.8;1.4;6.8;1.4;12.5;0.29;3.84
Soupe à la tomate, déshydratée reconstituée;39.6;0.98;6.45;0.98;11.0;0.14;0.0
Soupe aux champignons, déshydratée reconstituée;37.7;0.66;4.86;1.67;10.0;0.02;0.0
Soupe à l'oignon, déshydratée reconstituée;19.4;0.5;3.36;0.38;20.0;0.0;0.0
Soupe au potiron, préemballée à réchauffer;36.2;0.66;4.48;1.51;15.0;0.14;0.0
Bouillon de volaille, déshydraté reconstitué;7.19;1.23;0.28;0.13;5.0;0.05;0.0
Bouillon de légumes, déshydraté reconstitué;4.78;0.34;0.51;0.16;1.0;0.1;0.0
Soupe à la tomate et aux vermicelles, déshydratée reconstituée;27.7;0.8;5.36;0.29;9.1;0.18;0.0
Soupe à la volaille et aux vermicelles, déshydratée reconstituée;21.2;0.78;3.85;0.24;7.2;0.1;0.0
Soupe au pistou, préemballée à réchauffer;52.6;1.88;3.94;2.8;0.0;0.0;0.0
Soupe au potiron, déshydratée reconstituée;36.1;0.72;4.95;1.32;0.0;0.0;0.0
Soupe asiatique, avec pâtes, préemballée à réchauffer;33.5;1.3;4.06;1.23;0.0;0.0;0.0
Soupe minestrone, déshydratée reconstituée;32.4;1.11;5.56;0.44;0.0;0.0;5.0
Soupe au cresson, déshydratée reconstituée;25.1;0.42;3.95;0.8;0.0;0.0;0.0
Soupe au cresson, préemballée à réchauffer;34.0;1.0;5.4;0.8;0.0;0.0;0.0
Soupe aux légumes avec fromage, préemballée à réchauffer;46.3;1.26;4.77;2.26;0.0;0.0;11.0
Soupe aux légumes verts, préemballée à réchauffer;35.0;1.13;3.96;1.38;24.0;0.27;9.0
Soupe aux légumes verts, déshydratée reconstituée;32.0;0.63;4.84;1.05;12.0;0.11;6.0
Soupe aux pois cassés, préemballée à réchauffer;48.8;2.47;5.69;1.47;0.0;0.0;0.0
Soupe froide type gaspacho ou gazpacho, préemballée;40.2;0.81;3.21;2.33;11.0;0.11;1.98
Soupe aux asperges, préemballée à réchauffer;57.6;1.54;3.8;3.8;0.0;0.0;0.0
Soupe (aliment moyen);39.5;1.42;4.81;1.42;28.7;0.27;5.42
Soupe miso, déshydratée reconstituée;16.5;1.24;2.37;0.34;18.0;0.19;0.0
Soupe aux légumes et aux vermicelles, déshydratée reconstituée;35.6;0.8;6.19;0.77;0.0;0.0;0.0
Soupe aux légumes et aux vermicelles, préemballée à réchauffer;37.0;1.07;5.4;1.01;0.0;0.0;0.0
Soupe au boeuf et aux vermicelles, déshydratée reconstituée;22.6;0.87;4.29;0.15;0.0;0.0;0.0
Soupe asiatique, avec poulet et pâtes, préemballée à réchauffer;67.6;3.96;6.3;2.75;0.0;0.0;0.0
Nuggets ou croquette panée de poulet (contenant du soja), préemballé;220.0;13.4;16.7;10.3;23.6;0.84;3.22
Tripes à la mode de Caen (estomac et pied de boeuf, carottes…), préemballées;120.0;20.4;0.5;3.68;23.3;1.1;0.0
Tripes à la tomate ou à la provençale, préemballées;100.0;17.5;0.55;3.13;0.0;0.0;0.0
Blanquette de veau, préemballée;113.0;15.4;3.1;4.0;15.0;0.92;0.0
Boeuf bourguignon, préemballé;84.3;10.3;4.17;2.61;16.9;1.75;0.8
Sauté d'agneau au curry, préemballé;0.0;10.5;0.0;13.9;17.5;2.15;0.0
Canard en sauce (poivre vert, chasseur, etc.), préemballé;145.0;9.55;10.2;7.3;0.0;0.0;0.0
Lapin à la moutarde, préemballé;108.0;14.9;0.5;5.0;0.0;0.0;0.0
Cordon bleu de volaille, préemballé;226.0;14.0;14.6;12.2;60.6;0.68;0.0
Coq au vin;133.0;13.0;4.0;7.0;14.0;1.3;1.5
Paupiette de veau;181.0;14.6;4.67;11.3;27.6;1.0;1.34
Paupiette de volaille;163.0;17.4;8.8;6.19;27.6;1.03;1.33
Boulettes au boeuf, cuites;217.0;18.5;5.65;13.3;29.0;2.2;6.94
Viande en sauce (aliment moyen);109.0;11.7;4.23;4.7;16.1;1.06;1.06
Escalope panée, viennoise ou milanaise, veau, cuite;271.0;22.9;12.6;14.1;28.7;1.11;0.0063
Poulet au curry et au lait de coco, préemballé;125.0;10.6;4.07;6.9;18.0;0.51;2.51
Boulettes au porc et au boeuf (à la suédoise), préemballées, crues;254.0;17.4;4.8;18.2;0.0;0.0;0.0
Boulettes au boeuf et à l'agneau (type kefta), préemballées, crues;220.0;14.9;9.7;13.3;0.0;0.0;0.0
Palette à la diable, préemballée;102.0;13.0;1.0;4.5;0.0;1.0;0.0
Langue de boeuf sauce madère, préemballée;180.0;9.5;4.5;13.5;0.0;0.0;0.0
Porc au caramel, préemballé;136.0;10.0;11.4;5.4;9.9;0.49;0.0
Boulettes au boeuf, à la sauce tomate, préemballées;117.0;9.0;5.5;6.5;0.0;0.0;0.0
Paupiette de veau, préemballée, rôtie/cuite au four;276.0;22.0;0.48;20.5;24.0;0.94;1.62
Boulettes au boeuf et à l'agneau (type kefta), préemballées, cuites;235.0;15.7;7.5;15.7;24.0;2.4;0.0
Boulettes au porc et au boeuf (à la suédoise), préemballées, cuites;258.0;14.4;7.7;18.6;12.0;1.2;0.0
Brochette de volaille, crue;0.0;18.0;0.8;0.0;0.0;0.0;0.0
Brochette de boeuf, crue;0.0;20.0;0.0;0.0;0.0;0.0;0.0
Brochette mixte de viande;208.0;19.7;1.02;13.8;10.9;1.4;9.46
Nuggets ou croquette panée de volaille, préemballé;247.0;13.1;18.0;13.2;16.4;0.6;0.0
Carpaccio de boeuf, avec marinade (huile, herbes, fromage), fait maison;271.0;15.2;0.55;23.0;112.0;1.84;5.87
Brochette d'agneau;137.0;13.2;2.54;7.93;15.8;1.34;11.7
Yakitori (brochettes japonaises grillées en sauce);172.0;26.0;9.3;3.3;9.8;0.61;0.0
Brochette de porc, crue;131.0;15.6;2.1;6.5;0.0;0.0;0.0
Brochette de boeuf, cuite;136.0;21.9;0.33;5.2;23.0;2.4;10.8
Brochette de volaille, cuite;134.0;23.1;1.39;4.0;13.0;0.61;8.49
Nuggets ou croquette panée de poulet, préemballé;250.0;15.6;19.4;11.6;25.0;1.0;0.0
Poulet, manchons marinés, préemballés, rôtis/cuits au four;213.0;22.4;2.1;12.6;34.1;1.1;1.4
Escalope panée, viennoise ou milanaise, poulet, cuite;339.0;7.25;21.7;24.0;22.0;1.6;0.0
Escalope panée, viennoise ou milanaise, dinde, cuite;211.0;14.1;13.5;10.9;0.0;0.0;0.0
Hachis parmentier à la viande, préemballé;138.0;5.99;9.39;8.22;59.6;0.71;0.65
Couscous au mouton;149.0;8.31;12.2;7.2;31.6;1.24;5.0
Couscous à la viande ou au poulet, allégé en matière grasse, préemballé,;90.7;5.9;11.5;1.9;22.0;0.78;7.0
Poêlée de pommes de terre préfrites, lardons ou poulet, et autres, sans légumes verts, préemballée;171.0;3.2;17.0;9.6;26.0;0.49;3.04
Couscous royal (avec plusieurs viandes), préemballé;132.0;7.69;14.0;4.53;25.2;0.93;1.69
Couscous au poulet;130.0;7.5;15.6;3.85;18.4;0.86;4.05
Couscous à la viande, préemballé;128.0;7.59;12.5;4.73;25.2;0.0;0.0
Parmentier de canard, préemballé, à cuire;146.0;6.82;8.51;9.06;0.0;0.0;0.0
Parmentier de canard, préemballé, cuit;168.0;7.0;10.5;10.2;39.0;0.68;0.0
Cassoulet, appertisé;129.0;8.06;9.41;5.77;45.7;1.23;2.94
Choucroute garnie, préemballée;109.0;5.06;2.8;8.06;27.1;0.83;9.09
Petit salé ou saucisse aux lentilles, préemballé;118.0;8.24;8.89;4.87;20.0;1.8;0.0
Pot-au-feu, préemballé;77.5;10.9;3.2;2.02;23.5;1.69;0.0
Boeuf aux carottes, préemballé;95.0;13.2;2.91;3.15;15.9;0.9;0.0
Potée auvergnate (chou et porc);115.0;7.28;4.85;6.9;30.5;1.05;10.5
Cassoulet au porc, appertisé;132.0;8.3;8.6;6.3;0.0;0.0;0.0
Cassoulet au canard ou oie, appertisé;161.0;10.5;10.1;7.86;0.0;0.0;0.0
Tomate farcie, préemballée;127.0;6.0;2.95;9.67;18.4;0.87;7.0
Chou farci, préemballé;94.9;5.3;2.0;6.6;145.0;0.0;0.0
Chili con carne, préemballé;118.0;7.13;13.0;3.35;32.8;1.6;2.25
Moussaka, préemballée;147.0;5.82;5.16;10.8;16.0;0.62;0.0
Navarin d'agneau aux légumes;135.0;9.72;3.85;8.61;22.1;1.31;4.76
Tajine de mouton, préemballé;131.0;12.8;4.5;6.83;5.1;1.6;0.0
Osso buco de veau à la milanaise (jarret de porc , légumes, vin blanc);102.0;12.5;3.5;4.06;13.7;0.6;2.4
Meloukhia, plat à base de boeuf et corète, fait maison;189.0;10.6;1.2;14.7;51.3;2.4;1.5
Poulet basquaise, préemballé;107.0;9.3;2.5;6.4;0.0;0.0;0.0
Tajine de poulet, préemballé;127.0;7.54;14.4;3.7;18.0;0.45;0.0
Chop suey (porc ou poulet, légumes), préemballé;78.2;5.0;7.8;3.0;0.0;0.0;0.0
Légumes farcis (sauf tomate);91.9;4.71;3.6;6.22;27.1;0.56;4.86
Moules marinières (oignons et vin blanc), préemballées;91.9;10.3;7.43;2.24;0.0;0.0;0.0
Moules farcies (matière grasse, persillade…), préemballées, crues;283.0;9.56;4.2;24.8;40.0;2.5;0.0
Poisson blanc en sauce, préemballé (aliment moyen);147.0;13.2;4.67;8.1;19.7;1.0;9.7
Gratin ou cassolette de poisson et / ou fruits de mer, préemballé, cru;105.0;6.13;8.39;5.1;58.2;0.41;0.0
Gratin ou cassolette de poisson et / ou fruits de mer, préemballé, cuit;117.0;6.69;5.28;7.5;52.0;0.28;0.0
Saumon sauce à l'oseille, préemballé;157.0;9.5;8.23;9.5;0.0;0.0;0.0
Poisson blanc à la bordelaise (chapelure, huile…), préemballé;176.0;14.8;5.3;10.4;21.1;1.2;9.7
Poisson blanc à la provençale ou niçoise (sauce tomate), préemballé;73.4;9.31;3.1;2.3;16.1;0.0;0.0
Poisson blanc à la florentine (sauce aux épinards), préemballé;96.0;12.0;2.0;4.0;0.0;0.0;0.0
Poisson blanc à la marinière (sauce aux oignons, vin blanc, moules), préemballé;80.0;11.5;2.2;2.8;0.0;0.0;0.0
Poisson blanc à la sauce moutarde, préemballé;90.8;9.2;5.4;3.6;0.0;0.0;0.0
Poisson blanc à la parisienne (sauce aux champignons), préemballé;81.5;9.0;3.0;3.5;0.0;0.0;0.0
Poisson blanc à l'estragon, préemballé;77.2;8.8;4.2;2.8;0.0;0.0;0.0
Poisson blanc sauce oseille, préemballé;111.0;11.8;3.0;5.5;40.0;0.24;0.0
Saumon farci, préemballé;227.0;18.8;0.4;16.2;0.0;0.0;0.0
Brochette de poisson;127.0;18.0;0.86;5.71;26.5;0.72;6.33
Brochette de crevettes;140.0;16.4;1.6;7.38;81.2;1.85;8.33
Poisson cuit (aliment moyen);142.0;22.5;0.32;5.62;27.5;0.6;0.79
Poisson blanc, cuit (aliment moyen);114.0;22.0;0.32;2.74;26.4;0.44;0.51
Paëlla, préemballée;148.0;7.86;17.1;4.9;38.7;0.69;1.95
Couscous au poisson;105.0;7.5;14.2;1.6;24.0;4.1;7.6
Gratin de poisson et purée ou brandade aux pommes de terre ou parmentier de poisson, préemballé;117.0;6.39;8.57;6.15;46.8;0.0;0.0
Paëlla (poulet fruit de mer, chorizo, colin), fait maison;135.0;6.38;22.0;2.2;17.0;0.5;7.0
Sushi ou maki aux produits de la mer;171.0;6.69;26.9;3.7;16.0;0.25;1.11
Terrine ou mousse de légumes, premballée;140.0;6.67;5.5;9.56;68.6;1.76;2.16
Flan de légumes aux oeufs;210.0;5.38;4.13;18.6;72.0;0.75;0.0
Haricots blancs à la sauce tomate, appertisés;80.5;4.83;11.7;0.5;0.0;0.0;0.0
Piperade basquaise, préemballée;67.8;1.1;5.38;3.8;7.6;0.24;12.2
Poêlée de légumes assaisonnés sans champignon, surgelée, crue;50.4;2.6;5.0;1.5;24.5;6.0;30.8
Poêlée de légumes assaisonnés à l'asiatiques ou wok de légumes, surgelée, crue;73.5;1.75;4.0;5.0;0.0;0.0;0.0
Poêlée de légumes assaisonnés grillée, méridionale ou méditerranéenne, surgelée, crue;48.0;1.61;4.33;1.77;0.0;0.0;0.0
Poêlée de légumes assaisonnés aux champignons ("champêtre"), surgelée;31.5;1.5;4.0;0.5;0.0;0.0;0.0
Ratatouille cuisinée, préemballée;57.1;1.22;4.97;3.15;16.4;0.38;25.2
Épinard à la crème, préemballé;57.3;2.5;4.1;2.9;0.0;0.0;0.0
Gratin d'aubergine, préemballé;105.0;1.5;5.5;8.0;0.0;0.0;0.0
Gratin dauphinois, préemballé;113.0;3.38;14.5;4.2;38.6;0.32;3.1
Endive au jambon, préemballée;109.0;7.44;4.71;6.3;77.2;0.38;0.0
Gratin de chou-fleur, préemballé;86.3;3.0;3.3;6.5;96.6;0.27;0.0
Gratin de légumes, préemballé;106.0;3.44;6.91;6.7;0.0;0.0;0.0
Riste d'aubergines (aubergines, tomates, oignons), préemballée;145.0;1.05;10.6;10.4;0.0;0.0;0.0
Palet ou galette de légumes, préfrit, surgelé;101.0;2.33;8.67;5.67;0.0;0.0;0.0
Palet ou galette de légumes, préfrit, surgelé, cuit;105.0;3.31;8.45;5.7;40.0;0.52;1.23
Choucroute cuisinée aux lardons, sans garniture, égouttée, cuite;75.5;1.38;0.0;6.6;43.0;0.3;17.2
Gratin de légumes, fait maison;107.0;3.15;3.59;8.51;83.1;0.51;12.6
Tomate à la provençale, fait maison;75.7;1.65;6.55;4.32;23.0;0.67;21.5
Beignet de légumes;140.0;4.0;12.1;8.0;52.4;0.72;13.2
Falafel ou boulette de pois-chiche et/ou fève, vente à emporter;252.0;8.25;18.7;14.4;57.0;2.1;0.0
Gratin de légumes en sauce blanche type béchamel, préemballé, cuit;105.0;3.56;6.74;6.5;84.0;0.31;1.94
Falafel ou boulette de pois-chiche et/ou fève, préemballé;211.0;7.38;17.7;10.8;57.0;1.6;0.0
Blé dur précuit, cuisiné, en sachet micro-ondable;188.0;5.21;29.6;4.84;0.0;0.0;40.0
Nouilles asiatiques cuisinées (boeuf, poulet, légumes…) non instantanées;140.0;5.12;18.8;4.3;0.0;0.0;0.0
Ravioli au boeuf, sauce tomate, appertisé;95.3;4.22;12.5;2.83;25.3;1.09;1.22
Lasagnes ou canellonis à la viande (bolognaise), préemballés;134.0;6.29;13.5;5.72;44.8;0.71;2.46
Pâtes à la bolognaise (spaghetti, tagliatelles…), préemballées;116.0;5.32;13.6;4.07;14.0;0.79;4.22
Riz cantonais, préemballé;164.0;5.46;23.6;4.94;16.7;0.4;0.97
Ravioli chinois à la vapeur à la crevette, cuit;172.0;5.5;23.2;5.5;31.0;0.57;0.0
Gratin de pâtes au jambon, préemballé;179.0;7.06;16.4;9.2;116.0;0.0;0.0
Lasagnes ou cannellonis aux légumes, préemballées, cuits;120.0;4.38;10.1;5.9;76.0;0.62;3.34
Pâtes à la carbonara (spaghetti, tagliatelles…), préemballées;161.0;5.91;14.2;8.7;36.1;0.45;0.82
Lasagnes ou cannellonis au poisson, préemballées;148.0;7.28;13.0;7.1;63.0;0.41;0.0
Pâtes fraîches farcies (ex : raviolis, tortellinis, ravioles du Dauphiné), au fromage, préemballées, cuites;226.0;10.0;26.8;8.3;0.0;0.0;0.0
Couscous de légumes, préemballé;108.0;4.32;16.4;2.25;0.0;0.0;0.0
Pâtes fraîches farcies (ex : raviolis, tortellinis), au fromage et aux légumes, préemballées, cuites;219.0;7.94;27.8;7.5;69.0;0.57;0.0
Pâtes fraîches farcies (ex : raviolis, tortellinis), au boeuf (ex : bolognaise), préemballées, crues;265.0;11.4;40.3;5.79;37.5;0.72;0.0
Pâtes fraîches farcies (ex : raviolis, tortellinis), au boeuf (ex : bolognaise), préemballées, cuites;174.0;6.94;25.1;4.65;29.0;0.78;0.0
Pâtes fraîches farcies (ex : raviolis, tortellinis, ravioles du Dauphiné), au fromage, préemballées, crues;268.0;11.3;37.3;7.69;141.0;1.0;0.0
Pâtes fraîches farcies (ex : raviolis, tortellinis), au fromage et aux légumes, préemballées, crues;262.0;9.98;41.4;5.69;0.0;0.0;0.0
Nouilles aux crevettes, préemballées, sautées/poêlées;104.0;4.88;12.6;3.4;22.0;0.5;0.0
Risotto, aux légumes, préemballé;120.0;2.88;18.4;3.8;0.0;0.0;0.0
Risotto, aux fruits de mer, préemballé;130.0;5.75;12.5;6.07;0.0;0.0;0.0
Risotto, aux fromages, préemballé;195.0;5.93;30.9;5.16;0.0;0.0;0.0
Ravioli aux légumes, à la sauce tomate, appertisés;91.1;2.88;13.5;2.45;15.0;1.1;0.0
Pâtes fraîches farcies (ex : raviolis, tortellinis), aux légumes, préemballées, cuites;156.0;5.19;20.9;4.9;50.0;0.51;0.0
Pâtes en sauce aux fromages (spaghetti, tagliatelles…), préemballées;163.0;7.17;15.9;7.4;0.0;0.0;0.0
Pâtes fraîches farcies (ex : raviolis, tortellinis), aux légumes, préemballées, crues;255.0;9.4;41.4;5.06;0.0;0.0;0.0
Pâtes fraîches farcies (ex : raviolis, tortellinis), cuites (aliment moyen);198.0;7.97;25.6;6.48;44.1;0.67;0.0
Feuille de vigne farcie au riz ou dolmas, égouttée, préemballée;150.0;2.63;18.6;6.5;70.0;1.1;0.0
Lasagnes ou cannellonis aux légumes et au fromage de chèvre, préemballés, cuits;179.0;7.0;14.0;10.2;32.0;0.18;0.67
Nouilles asiatiques instantanées, aromatisées, cuites;164.0;3.75;21.1;6.9;11.0;0.32;0.0
Lasagnes ou cannellonis au fromage et aux épinards, préemballés;133.0;6.1;11.4;6.6;0.0;0.0;0.0
Aligot (purée de pomme de terre à la tomme fraîche), préemballé;195.0;8.06;9.5;13.3;0.0;0.0;0.0
Fromage de chèvre pané à dorer, préemballé;0.0;12.7;15.0;19.2;100.0;0.27;0.0
Soufflé au fromage;185.0;10.9;4.75;13.4;226.0;0.6;1.0
Tartiflette (pommes de terre, reblochon, lardons…), préemballée;161.0;6.0;13.5;8.9;74.0;0.26;0.0
Gougère;399.0;16.2;22.7;26.6;302.0;1.34;0.0
Préparation à base de fromage(s) pour fondue savoyarde, préemballée;237.0;14.6;3.4;17.1;475.0;0.3;0.0
Fromage pané au jambon, préemballé;262.0;17.4;15.3;14.6;84.9;0.8;0.0
Galette ou pavé au soja;252.0;17.0;8.5;14.7;160.0;2.3;2.0
Bouchées ou émincé végétal au soja et blé (convient aux véganes ou végétaliens), préemballé;157.0;21.3;6.76;3.7;72.0;2.8;0.0
Bouchées ou émincé au soja et blé  (ne convient pas aux véganes ou végétaliens), préemballé;185.0;19.3;8.19;7.0;74.0;1.8;2.86
Nuggets ou croquette panée de blé (sans soja), préemballé;284.0;13.5;22.4;14.9;22.0;0.88;0.0
Nuggets ou croquette panée de soja et blé (ne convient pas aux véganes ou végétaliens), préemballé;253.0;14.1;18.5;12.6;55.0;1.7;4.36
Nuggets ou croquette panée de soja et blé (convient aux véganes ou végétaliens), préemballé;251.0;15.5;19.7;10.9;61.0;2.4;0.0
Pané soja et blé (ne convient pas aux véganes ou végétaliens);260.0;14.4;16.8;13.9;50.0;2.2;0.0
Bâtonnet pané soja et blé (convient aux véganes ou végétaliens), préemballée;245.0;16.9;18.8;10.0;70.0;2.5;0.0
Pané soja, blé et fromage, type cordon bleu, préemballé;247.0;15.2;15.1;13.1;170.0;1.3;0.0
Ravioli au tofu, à la sauce tomate, préemballés;91.7;3.13;12.5;2.7;28.0;0.68;0.0
Galette de céréales au fromage (sans soja), préemballée;241.0;7.0;27.8;10.3;93.0;1.1;0.0
Galette de céréales aux légumes (sans soja), préemballée;211.0;5.31;28.0;7.6;29.0;1.3;0.0
Boulette végétale au soja et/ou blé, préemballée;211.0;17.6;7.98;10.6;73.0;2.4;0.0
Galette ou pavé aux lentilles, soja et légumes, préemballé;170.0;10.6;16.7;5.6;69.0;1.9;0.0
Galette ou pavé au blé (seitan) et légumes, préemballé;208.0;13.4;20.8;7.1;42.0;1.2;0.0
Galette ou pavé au blé et soja (convient aux véganes ou végétaliens), préemballé;215.0;17.5;8.15;11.0;89.0;3.3;0.0
Galette ou pavé au blé et soja (ne convient pas aux véganes ou végétaliens), préemballé;201.0;11.1;13.3;10.2;72.0;2.2;0.0
Galette ou pavé au soja et fromage, préemballé;204.0;16.8;6.08;12.0;250.0;1.8;0.0
Galette ou pavé au soja et légumes, préemballé;175.0;14.4;8.36;8.1;99.0;2.1;0.0
Galette ou pavé au soja, fromage et légumes, préemballé;180.0;15.1;7.72;9.1;170.0;2.0;0.0
Haché végétal à base de soja, préemballé;143.0;12.6;7.01;5.8;67.0;2.2;0.0
Pizza au fromage ou pizza margherita, préemballée;224.0;8.7;29.6;7.41;239.0;1.2;5.5
Quiche lorraine, préemballée;269.0;8.39;21.5;16.4;116.0;0.63;0.71
Crêpe ou galette béchamel et jambon, préemballée;199.0;7.5;24.3;8.0;0.0;0.0;0.0
Crêpe ou galette béchamel, jambon et fromage, préemballée;179.0;9.83;16.3;7.9;99.1;0.54;1.59
Crêpe ou galette béchamel et champignon, préemballée, surgelée;144.0;4.5;20.0;5.0;82.8;0.3;0.0
Tarte aux légumes, préemballée;216.0;5.0;21.8;11.7;104.0;0.0;0.0
Pizza jambon fromage, préemballée;228.0;10.7;26.2;8.49;174.0;0.7;1.45
Tarte au fromage, préemballée;271.0;9.44;20.0;16.7;170.0;0.54;0.21
Tarte à la provençale, préemballée;224.0;5.34;21.8;12.5;62.5;0.63;4.25
Pizza à la viande, type bolognaise, préemballée;214.0;9.7;27.0;7.03;144.0;1.36;4.2
Burritos au boeuf;170.0;8.0;14.3;8.5;88.0;1.1;6.5
Fajita au poulet, préparé maison avec un kit;158.0;12.7;16.0;4.5;77.0;0.55;19.6
Pizza au chorizo ou salami, préemballée;236.0;9.88;24.7;10.4;135.0;0.0;0.0
Pizza aux fruits de mer, préemballée;215.0;9.67;25.2;8.02;0.0;0.0;0.0
Pizza au saumon, préemballée;232.0;9.28;26.0;9.72;110.0;0.54;0.0
Pizza au chèvre et lardons, préemballée;253.0;10.3;26.5;11.5;136.0;0.0;0.0
Pizza aux légumes ou pizza 4 saisons, préemballée;206.0;7.58;25.1;7.78;120.0;0.61;1.52
Pizza champignons fromage, préemballée;213.0;8.0;24.2;8.93;0.0;0.0;0.0
Pizza aux fromages, préemballée;269.0;11.2;30.5;10.7;267.0;0.81;3.64
Pizza (aliment moyen);234.0;10.0;27.4;8.88;193.0;0.76;3.39
Pissaladière, préemballée;265.0;4.8;26.3;15.1;0.0;0.0;0.0
Tarte à l'oignon, préemballée;280.0;7.0;23.5;17.2;0.0;0.0;0.0
Pizza jambon fromage champignons ou pizza royale, reine ou regina, préemballée;208.0;9.5;25.9;6.89;155.0;0.7;4.84
Crêpe ou galette béchamel et fromage, préemballée;150.0;6.5;17.0;6.0;148.0;0.48;0.37
Flammenkueche ou tarte flambée aux lardons, préemballée;300.0;8.81;31.8;14.8;52.0;0.6;0.8
Crêpe ou galette béchamel, jambon et fromage et champignon, préemballée;144.0;6.56;14.7;6.3;35.3;0.6;1.23
Tarte ou tourte aux poireaux, préemballée;229.0;5.29;20.9;13.3;95.0;0.6;0.0
Tarte au saumon, préemballée;251.0;8.41;24.2;13.2;59.2;0.63;1.83
Tourte au riesling (porc, riesling, champignons), préemballée;251.0;10.2;23.7;12.6;0.0;0.0;0.0
Tarte à la tomate, préemballée;225.0;6.0;23.4;11.6;21.0;0.77;5.2
Crêpe ou galette complète (oeuf, jambon, fromage), préemballée;219.0;15.3;15.2;9.8;240.0;0.96;0.9
Tarte aux noix de Saint-Jacques, préemballée;222.0;7.2;21.7;11.5;0.0;0.0;0.0
Pastilla au poulet, préemballée;218.0;12.3;14.1;12.2;0.0;0.0;0.0
